<?xml version="1.0" encoding="UTF-8"?>
<!DOCTYPE bets SYSTEM "bets.dtd">
<bets>
    <handicap team_left="0" team_right="0">
        <interval>
            <default_interval>OVERALL</default_interval>
        </interval>
        <options>
            <option modifier="EXACT_MATCH">
                <value>-1</value>
                <odds>1.50</odds>
                <display_text>TEAM_LEFT</display_text>
            </option>
            <option modifier="EXACT_MATCH">
                <value>0</value>
                <odds>1.25</odds>
                <display_text>DRAW</display_text>
            </option>
            <option modifier="EXACT_MATCH">
                <value>1</value>
                <odds>1.50</odds>
                <display_text>TEAM_RIGHT</display_text>
            </option>
        </options>
    </handicap>
</bets>
